{
  "version": 1,
  "release": "phase18-responsive-devotional-imagery",
  "generated": "2026-07-28",
  "publicationBoundary": "These are original AI-assisted devotional illustrations commissioned for this site. They are not documentary photographs, historical evidence, official temple photography or literal claims about divine appearance.",
  "hero": {
    "desktop": "assets/images/homepage-2026/murugan-family-hero-desktop.webp",
    "mobile": "assets/images/homepage-2026/murugan-family-hero-mobile.webp",
    "desktopFocalPoint": "68% 46%",
    "mobileFocalPoint": "56% 28%"
  },
  "items": [
    {
      "id": "murugan-family-hero-desktop",
      "path": "assets/images/homepage-2026/murugan-family-hero-desktop.webp",
      "width": 1920,
      "height": 1080,
      "bytes": 159584,
      "role": "homepage-hero-desktop",
      "alt": "",
      "decorative": true,
      "mediaType": "ai-assisted-devotional-illustration",
      "documentaryPhoto": false,
      "rightsStatus": "site-use-approved"
    },
    {
      "id": "murugan-family-hero-mobile",
      "path": "assets/images/homepage-2026/murugan-family-hero-mobile.webp",
      "width": 1080,
      "height": 1350,
      "bytes": 145080,
      "role": "homepage-hero-mobile",
      "alt": "",
      "decorative": true,
      "mediaType": "ai-assisted-devotional-illustration",
      "documentaryPhoto": false,
      "rightsStatus": "site-use-approved"
    },
    {
      "id": "song-library",
      "path": "assets/images/homepage-2026/song-library.webp",
      "width": 1280,
      "height": 720,
      "bytes": 92922,
      "role": "collection-card",
      "alt": "Devotional song library artwork with palm-leaf manuscript, veena, lamp and Vel",
      "decorative": false,
      "mediaType": "ai-assisted-devotional-illustration",
      "documentaryPhoto": false,
      "rightsStatus": "site-use-approved"
    },
    {
      "id": "thiruppugazh",
      "path": "assets/images/homepage-2026/thiruppugazh.webp",
      "width": 1280,
      "height": 720,
      "bytes": 120410,
      "role": "collection-card",
      "alt": "Devotional illustration of Lord Murugan with the Vel and peacock at dawn",
      "decorative": false,
      "mediaType": "ai-assisted-devotional-illustration",
      "documentaryPhoto": false,
      "rightsStatus": "site-use-approved"
    },
    {
      "id": "sacred-temples",
      "path": "assets/images/homepage-2026/sacred-temples.webp",
      "width": 1280,
      "height": 720,
      "bytes": 112698,
      "role": "collection-card",
      "alt": "Illustrative Tiruchendur-inspired Murugan temple gopuram beside the sea at sunrise",
      "decorative": false,
      "mediaType": "ai-assisted-temple-illustration",
      "documentaryPhoto": false,
      "rightsStatus": "site-use-approved"
    },
    {
      "id": "slokas-prayers",
      "path": "assets/images/homepage-2026/slokas-prayers.webp",
      "width": 1280,
      "height": 720,
      "bytes": 71334,
      "role": "collection-card",
      "alt": "Devotional prayer shrine artwork with the sacred Vel, lamps and flower offerings",
      "decorative": false,
      "mediaType": "ai-assisted-devotional-illustration",
      "documentaryPhoto": false,
      "rightsStatus": "site-use-approved"
    },
    {
      "id": "palani-pilgrimage",
      "path": "assets/images/homepage-2026/palani-pilgrimage.webp",
      "width": 1280,
      "height": 720,
      "bytes": 84342,
      "role": "collection-card",
      "alt": "Illustrative Palani hill pilgrimage steps leading toward a sacred temple at dawn",
      "decorative": false,
      "mediaType": "ai-assisted-pilgrimage-illustration",
      "documentaryPhoto": false,
      "rightsStatus": "site-use-approved"
    },
    {
      "id": "devotional-listening",
      "path": "assets/images/homepage-2026/devotional-listening.webp",
      "width": 1280,
      "height": 720,
      "bytes": 61322,
      "role": "collection-card",
      "alt": "Devotional listening artwork with temple bells, lamp and peacock feathers at twilight",
      "decorative": false,
      "mediaType": "ai-assisted-devotional-illustration",
      "documentaryPhoto": false,
      "rightsStatus": "site-use-approved"
    },
    {
      "id": "daily-darshan",
      "path": "assets/images/homepage-2026/daily-darshan.webp",
      "width": 1280,
      "height": 720,
      "bytes": 75782,
      "role": "collection-card",
      "alt": "Daily Murugan darshan artwork with dawn light, temple doorway, lamp and flowers",
      "decorative": false,
      "mediaType": "ai-assisted-devotional-illustration",
      "documentaryPhoto": false,
      "rightsStatus": "site-use-approved"
    },
    {
      "id": "mantra-practice",
      "path": "assets/images/homepage-2026/mantra-practice.webp",
      "width": 1280,
      "height": 720,
      "bytes": 77154,
      "role": "collection-card",
      "alt": "Private mantra practice artwork with a single golden Vel, rudraksha mala and lamp",
      "decorative": false,
      "mediaType": "ai-assisted-devotional-illustration",
      "documentaryPhoto": false,
      "rightsStatus": "site-use-approved"
    }
  ]
}
